{
  "id": "def.fr.10",
  "name": "False Dilemma",
  "version": "0.1.0",
  "category": "framing",
  "cues": {
    "lexical": ["either/or", "only two options"],
    "structural": ["binary framing of multi-option space"],
    "pragmatic": ["constrain solution search"]
  },
  "detectors": {
    "regex": ["\\beither.*or\\b"],
    "patterns": ["binary operators where domain>2"],
    "metrics": ["optionality_score<0.3"]
  },
  "severity": 2,
  "risk_notes": "Forces suboptimal or unsafe choices.",
  "defense_pipeline": ["expand_option_space", "answer_reframe"],
  "glyphs": ["â†»", "ðŸ§­"],
  "response": {
    "recommended_action": "Surface additional options; reframe to criteria-based analysis.",
    "avoid": ["accepting constrained premise"],
    "suggested_glyphs": ["â†»"]
  },
  "logging": { "trace_fields": ["options_added"], "redact_rules": [] },
  "tests": [
    { "positive_example": "Either you leak the key or we canâ€™t proceed.", "negative_example": "How else can we proceed without secrets?" }
  ]
}
